{
  "schema_version": "1.0.0",
  "routing_receipt_id": "EXAMPLE-ROUTE-001",
  "request_id": "EXAMPLE-REQ-LOCAL-001",
  "selected_runtime": "LAYA_LOCAL",
  "provider_ref": "LAYA_LOCAL",
  "routing_outcome": "ROUTED",
  "reasons": [
    "local_required",
    "typed_decision",
    "provider_allowlisted",
    "external_cost_budget_zero"
  ],
  "estimated_external_cost_usd": "0.00",
  "billable": false,
  "authority_precheck_ref": "EXAMPLE-M5CANON-PREFLIGHT-001",
  "created_at": "2026-09-22T20:00:00Z",
  "versions": {
    "adapter_revision": "SYN-1.0",
    "m5canon_policy_version": "SYN-1.0",
    "event_contract_version": "1.0.0",
    "meter_version": "1.0.0",
    "reference_catalog_version": "M5-REFERENCE-PRICE-2026-09-v1",
    "settlement_adapter_version": "SYN-1.0",
    "activation_version": "SYN-1.0",
    "runtime_version": "SYN-1.0",
    "api_version": "SYN-1.0",
    "model_family": "SYN-1.0",
    "model_revision": "SYN-1.0",
    "model_artifact_hash": "sha256:0000000000000000000000000000000000000000000000000000000000000000"
  }
}
